{"$schema":"https://json-schema.org/draft/2020-12/schema","type":"object","properties":{"version":{"default":"1","type":"string","const":"1"},"narrative":{"anyOf":[{"type":"string"},{"type":"object","propertyNames":{"type":"string"},"additionalProperties":{}}]},"theme":{"type":"string","pattern":"^[a-z0-9-]+$"},"filename":{"type":"string"},"meta":{"default":{},"type":"object","properties":{"organization":{"type":"string"},"authors":{"type":"array","items":{"type":"object","properties":{"name":{"type":"string"},"role":{"type":"string"},"org":{"type":"string"}},"required":["name"],"additionalProperties":false}},"date":{"type":"string"},"version":{"type":"string"},"confidentiality":{"description":"How far the deck may travel. Prints nothing by itself: footer.confidentiality decides whether the mark goes on the cover or also on every content page. \"public\" never prints a mark.","type":"string","enum":["public","internal","confidential","restricted"]},"classification":{"description":"A legal classification and its term, written exactly as given (e.g. \"秘密★1年\"). Prints on the cover only, top left. Cannot be combined with footer.confidentiality.","type":"string"},"contact":{"type":"object","properties":{"name":{"type":"string"},"email":{"type":"string"},"phone":{"type":"string"},"website":{"type":"string"}},"additionalProperties":false},"copyright":{"type":"string"},"animation":{"type":"object","properties":{"transition":{"type":"string","enum":["fade","push","wipe","none"]},"elements":{"type":"string","enum":["none","auto"]}},"additionalProperties":false}},"additionalProperties":false},"brand":{"type":"object","properties":{"logo_asset_id":{"type":"string"},"position":{"type":"string","enum":["tl","tr","bl","br"]}},"additionalProperties":false},"branding":{"type":"string","enum":["full","cover-only","minimal"],"description":"Where the brand logo appears. Omitted equals \"cover-only\": cover and chapter pages keep the logo, content and ending pages carry none. \"full\" and \"minimal\" keep the logo on every page. \"full\" also paints the date on cover and ending meta rows, and without a footer object it stands for footer {organization, confidentiality: \"footer\"}. Page marks such as page numbers live in footer. Layout branding:\"none\" still wins. Theme motifs are unaffected."},"footer":{"type":"object","properties":{"page_number":{"description":"Print the page number on content pages, bottom right. Cover, chapter and ending pages carry none. Exported as PowerPoint's own slide-number field.","type":"boolean"},"organization":{"description":"Print meta.organization on content pages, bottom left. Requires meta.organization.","type":"boolean"},"label":{"description":"The author's own occasion-and-date line, printed as written after the organization, e.g. \"2026 年中期业绩 | 2026.08\" or \"Investor Presentation | February 2026\".","type":"string"},"notice":{"description":"The author's own copyright line or disclaimer pointer, printed as written after the label.","type":"string"},"draft":{"description":"The author's own draft or version mark, e.g. \"讨论稿\" or \"Draft for discussion\", printed bottom right before the page number.","type":"string"},"confidentiality":{"description":"Where the meta.confidentiality mark goes. \"cover\" prints it once on the cover. \"footer\" prints it on the cover and bottom right on every content page. Requires meta.confidentiality other than \"public\".","type":"string","enum":["footer","cover"]}},"additionalProperties":false,"description":"Small marks printed in the page corners. Omitted, the deck prints none. Every text is the author's own or comes from meta."},"course":{"type":"object","properties":{"stages":{"minItems":2,"maxItems":8,"type":"array","items":{"type":"object","properties":{"label":{"type":"string","description":"The stage as the strip names it, in a few characters, such as \"环节一\", \"小测一\" or \"Part 1\"."},"quiz":{"description":"Marks a stage where the room checks what it has learned, such as a quiz or a test: its pill is drawn dashed.","type":"boolean"}},"required":["label"],"additionalProperties":false},"description":"Two to 8 stages in the order the talk runs through them."}},"required":["stages"],"additionalProperties":false,"description":"The stages a talk runs through in order, such as the parts and quizzes of a lesson: { \"stages\": [{ \"label\": \"目标\" }, { \"label\": \"环节一\" }, { \"label\": \"小测一\", \"quiz\": true }] }. Each page names its own stage. Drawn only by faces that have a place for a page's stage: validate says which."},"pages":{"type":"array","items":{"oneOf":[{"type":"object","properties":{"type":{"type":"string","const":"cover"},"id":{"type":"string"},"heading":{"type":"string"},"focus":{"type":"string"},"summary":{"type":"string"},"kicker":{"type":"string"}},"required":["type","id","heading"],"additionalProperties":false},{"type":"object","properties":{"type":{"type":"string","const":"chapter"},"id":{"type":"string"},"heading":{"type":"string"},"focus":{"type":"string"},"summary":{"type":"string"},"kicker":{"type":"string"}},"required":["type","id","heading"],"additionalProperties":false},{"type":"object","properties":{"type":{"type":"string","const":"content"},"kind":{"type":"string","enum":["points","list","comparison","process","data","photo","statement","quote","fact","evidence","hierarchy"]},"id":{"type":"string"},"heading":{"type":"string"},"focus":{"type":"string"},"summary":{"type":"string"},"kicker":{"type":"string"}},"required":["type","kind","id","heading"],"additionalProperties":false},{"type":"object","properties":{"type":{"type":"string","const":"ending"},"id":{"type":"string"},"heading":{"type":"string"},"focus":{"type":"string"},"summary":{"type":"string"},"kicker":{"type":"string"}},"required":["type","id","heading"],"additionalProperties":false}]}}},"required":["version","theme","meta","pages"],"additionalProperties":false}
