{
  "version": "1",
  "filename": "deck.pptx",
  "meta": {
    "confidentiality": "public"
  },
  "narrative": {
    "strategy": "instructional",
    "pacing": "balanced",
    "audience": "public"
  },
  "theme": "font-catalog",
  "footer": {
    "page_number": true,
    "notice": "実カタログ / 2026-10-15"
  },
  "pages": [
    {
      "id": "open",
      "type": "cover",
      "heading": "資料に使うフォントを選ぶ",
      "summary": "実カタログの書体・構成・利用条件"
    },
    {
      "id": "promise",
      "type": "content",
      "heading": "候補の範囲を、元データで確かめる",
      "kind": "statement"
    },
    {
      "id": "journey",
      "type": "content",
      "heading": "条件から選び、実際の文面で確かめる",
      "kind": "process"
    },
    {
      "id": "network",
      "type": "content",
      "heading": "書体と利用条件を一緒に確認する",
      "kind": "hierarchy"
    },
    {
      "id": "space",
      "type": "content",
      "heading": "30書体の内訳は和文17・欧文13",
      "kind": "hierarchy"
    },
    {
      "id": "close",
      "type": "ending",
      "heading": "配布前に、書体と利用条件を確かめる",
      "summary": "候補を選んだら、元配布と実文面へ戻る"
    }
  ]
}
